{
  "schema_version": "1.0",
  "universe_id": "ACME_PLUMBING_SYNTHETIC-EXAMPLE_COUNTY-V1",
  "universe_version": "1.0.0",
  "trade": "plumbing",
  "market": {
    "name": "Example County, CA",
    "region": "CA",
    "country": "US",
    "language": "en",
    "device": "mobile",
    "center": {
      "lat": 34,
      "lng": -117
    },
    "radius_km": 12
  },
  "language": "en",
  "device": "mobile",
  "created_at": "2026-01-01T00:00:00Z",
  "locked_at": "2026-01-01T00:00:00Z",
  "locked": true,
  "generation_method": "deterministic_service_intent_templates_v1",
  "review": {
    "status": "approved",
    "reviewed_at": "2026-01-01T00:00:00Z",
    "reviewer": "synthetic-fixture"
  },
  "hash": "sha256:f1e8f2e1817f87f64c6c07801b91315c0e51458eecf7496da8f060db92c93d6c",
  "services": [
    {
      "id": "general_plumbing",
      "label": "plumber",
      "priority": "primary",
      "symptoms": [
        "leaking pipe",
        "low water pressure"
      ],
      "demand": {
        "volume": 3600,
        "cpc": 12.4,
        "trend": 0.02
      }
    },
    {
      "id": "emergency_plumbing",
      "label": "emergency plumber",
      "priority": "primary",
      "symptoms": [
        "burst pipe",
        "no hot water"
      ],
      "demand": {
        "volume": 1600,
        "cpc": 21.5,
        "trend": 0.05
      }
    },
    {
      "id": "drain_cleaning",
      "label": "drain cleaning",
      "priority": "primary",
      "symptoms": [
        "clogged drain",
        "slow sink"
      ],
      "demand": {
        "volume": 2400,
        "cpc": 9.8,
        "trend": 0.01
      }
    },
    {
      "id": "water_heater_repair",
      "label": "water heater repair",
      "priority": "primary",
      "symptoms": [
        "water heater not working",
        "no hot water"
      ],
      "demand": {
        "volume": 1900,
        "cpc": 15.2,
        "trend": 0.03
      }
    },
    {
      "id": "sewer_repair",
      "label": "sewer repair",
      "priority": "secondary",
      "symptoms": [
        "sewage backup",
        "broken sewer line"
      ],
      "demand": {
        "volume": 720,
        "cpc": 18,
        "trend": 0
      }
    },
    {
      "id": "repiping",
      "label": "repiping",
      "priority": "secondary",
      "symptoms": [
        "old pipes",
        "pipe replacement"
      ],
      "demand": {
        "volume": 390,
        "cpc": 16.5,
        "trend": 0.04
      }
    }
  ],
  "intents": [
    {
      "service_id": "general_plumbing",
      "brand": "non_brand",
      "core": true,
      "demand": {
        "volume": 3600,
        "cpc": 12.4,
        "trend": 0.02,
        "source": "synthetic_fixture"
      },
      "weight": 0.027343,
      "id": "INT-general_plumbing-SERVICE",
      "class": "service",
      "label": "plumber"
    },
    {
      "service_id": "general_plumbing",
      "brand": "non_brand",
      "core": true,
      "demand": {
        "volume": 3600,
        "cpc": 12.4,
        "trend": 0.02,
        "source": "synthetic_fixture"
      },
      "weight": 0.027343,
      "id": "INT-general_plumbing-NEAR_ME",
      "class": "near_me",
      "label": "plumber near me"
    },
    {
      "service_id": "general_plumbing",
      "brand": "non_brand",
      "core": true,
      "demand": {
        "volume": 3600,
        "cpc": 12.4,
        "trend": 0.02,
        "source": "synthetic_fixture"
      },
      "weight": 0.027343,
      "id": "INT-general_plumbing-CITY",
      "class": "city_modified",
      "label": "plumber Example County"
    },
    {
      "service_id": "general_plumbing",
      "brand": "non_brand",
      "core": true,
      "demand": {
        "volume": 3600,
        "cpc": 12.4,
        "trend": 0.02,
        "source": "synthetic_fixture"
      },
      "weight": 0.027343,
      "id": "INT-general_plumbing-PROBLEM",
      "class": "problem_symptom",
      "label": "leaking pipe repair"
    },
    {
      "service_id": "general_plumbing",
      "brand": "non_brand",
      "core": true,
      "demand": {
        "volume": 3600,
        "cpc": 12.4,
        "trend": 0.02,
        "source": "synthetic_fixture"
      },
      "weight": 0.027343,
      "id": "INT-general_plumbing-HIGH_TICKET",
      "class": "high_ticket",
      "label": "plumber contractor"
    },
    {
      "service_id": "emergency_plumbing",
      "brand": "non_brand",
      "core": true,
      "demand": {
        "volume": 1600,
        "cpc": 21.5,
        "trend": 0.05,
        "source": "synthetic_fixture"
      },
      "weight": 0.028862,
      "id": "INT-emergency_plumbing-SERVICE",
      "class": "service",
      "label": "emergency plumber"
    },
    {
      "service_id": "emergency_plumbing",
      "brand": "non_brand",
      "core": true,
      "demand": {
        "volume": 1600,
        "cpc": 21.5,
        "trend": 0.05,
        "source": "synthetic_fixture"
      },
      "weight": 0.028862,
      "id": "INT-emergency_plumbing-NEAR_ME",
      "class": "near_me",
      "label": "emergency plumber near me"
    },
    {
      "service_id": "emergency_plumbing",
      "brand": "non_brand",
      "core": true,
      "demand": {
        "volume": 1600,
        "cpc": 21.5,
        "trend": 0.05,
        "source": "synthetic_fixture"
      },
      "weight": 0.028862,
      "id": "INT-emergency_plumbing-CITY",
      "class": "city_modified",
      "label": "emergency plumber Example County"
    },
    {
      "service_id": "emergency_plumbing",
      "brand": "non_brand",
      "core": true,
      "demand": {
        "volume": 1600,
        "cpc": 21.5,
        "trend": 0.05,
        "source": "synthetic_fixture"
      },
      "weight": 0.028862,
      "id": "INT-emergency_plumbing-PROBLEM",
      "class": "problem_symptom",
      "label": "burst pipe repair"
    },
    {
      "service_id": "emergency_plumbing",
      "brand": "non_brand",
      "core": true,
      "demand": {
        "volume": 1600,
        "cpc": 21.5,
        "trend": 0.05,
        "source": "synthetic_fixture"
      },
      "weight": 0.028862,
      "id": "INT-emergency_plumbing-HIGH_TICKET",
      "class": "high_ticket",
      "label": "emergency plumber contractor"
    },
    {
      "service_id": "drain_cleaning",
      "brand": "non_brand",
      "core": true,
      "demand": {
        "volume": 2400,
        "cpc": 9.8,
        "trend": 0.01,
        "source": "synthetic_fixture"
      },
      "weight": 0.033333,
      "id": "INT-drain_cleaning-SERVICE",
      "class": "service",
      "label": "drain cleaning"
    },
    {
      "service_id": "drain_cleaning",
      "brand": "non_brand",
      "core": true,
      "demand": {
        "volume": 2400,
        "cpc": 9.8,
        "trend": 0.01,
        "source": "synthetic_fixture"
      },
      "weight": 0.033333,
      "id": "INT-drain_cleaning-NEAR_ME",
      "class": "near_me",
      "label": "drain cleaning near me"
    },
    {
      "service_id": "drain_cleaning",
      "brand": "non_brand",
      "core": true,
      "demand": {
        "volume": 2400,
        "cpc": 9.8,
        "trend": 0.01,
        "source": "synthetic_fixture"
      },
      "weight": 0.033333,
      "id": "INT-drain_cleaning-CITY",
      "class": "city_modified",
      "label": "drain cleaning Example County"
    },
    {
      "service_id": "drain_cleaning",
      "brand": "non_brand",
      "core": true,
      "demand": {
        "volume": 2400,
        "cpc": 9.8,
        "trend": 0.01,
        "source": "synthetic_fixture"
      },
      "weight": 0.033333,
      "id": "INT-drain_cleaning-PROBLEM",
      "class": "problem_symptom",
      "label": "clogged drain repair"
    },
    {
      "service_id": "drain_cleaning",
      "brand": "non_brand",
      "core": true,
      "demand": {
        "volume": 2400,
        "cpc": 9.8,
        "trend": 0.01,
        "source": "synthetic_fixture"
      },
      "weight": 0.033333,
      "id": "INT-drain_cleaning-HIGH_TICKET",
      "class": "high_ticket",
      "label": "drain cleaning contractor"
    },
    {
      "service_id": "water_heater_repair",
      "brand": "non_brand",
      "core": true,
      "demand": {
        "volume": 1900,
        "cpc": 15.2,
        "trend": 0.03,
        "source": "synthetic_fixture"
      },
      "weight": 0.033333,
      "id": "INT-water_heater_repair-SERVICE",
      "class": "service",
      "label": "water heater repair"
    },
    {
      "service_id": "water_heater_repair",
      "brand": "non_brand",
      "core": true,
      "demand": {
        "volume": 1900,
        "cpc": 15.2,
        "trend": 0.03,
        "source": "synthetic_fixture"
      },
      "weight": 0.033333,
      "id": "INT-water_heater_repair-NEAR_ME",
      "class": "near_me",
      "label": "water heater repair near me"
    },
    {
      "service_id": "water_heater_repair",
      "brand": "non_brand",
      "core": true,
      "demand": {
        "volume": 1900,
        "cpc": 15.2,
        "trend": 0.03,
        "source": "synthetic_fixture"
      },
      "weight": 0.033333,
      "id": "INT-water_heater_repair-CITY",
      "class": "city_modified",
      "label": "water heater repair Example County"
    },
    {
      "service_id": "water_heater_repair",
      "brand": "non_brand",
      "core": true,
      "demand": {
        "volume": 1900,
        "cpc": 15.2,
        "trend": 0.03,
        "source": "synthetic_fixture"
      },
      "weight": 0.033333,
      "id": "INT-water_heater_repair-PROBLEM",
      "class": "problem_symptom",
      "label": "water heater not working repair"
    },
    {
      "service_id": "water_heater_repair",
      "brand": "non_brand",
      "core": true,
      "demand": {
        "volume": 1900,
        "cpc": 15.2,
        "trend": 0.03,
        "source": "synthetic_fixture"
      },
      "weight": 0.033333,
      "id": "INT-water_heater_repair-HIGH_TICKET",
      "class": "high_ticket",
      "label": "water heater repair contractor"
    },
    {